{
  "schema_version": 1,
  "date_utc": "2026-05-09",
  "agent_role": "tooling",
  "task_id": "FACTORY_010_qms_inbox_validator",
  "depends_on": ["FACTORY_009_qms_inbox_record_schema"],
  "spec_pr_refs": ["agents/agent-record-for-qms.md"],
  "evidence_paths": ["factory/validate-qms-inbox.ts"],
  "handoff_next_role": "quality"
}
